{
  "name": "Default",
  "author": "mp3palace",
  "version": "1.0.0",
  "apiVersion": 1,
  "description": "The built-in dark theme. Every other theme inherits anything it leaves out from this one.",
  "colors": {
    "bg": "#0e0e10",
    "surface": "#141416",
    "surface2": "#1c1c20",
    "elevated": "#232328",
    "text": "#f2f2f4",
    "textMuted": "#9a9aa3",
    "accent": "#8b5cf6",
    "accentText": "#ffffff",
    "border": "#26262c",
    "hover": "rgba(255,255,255,0.06)",
    "danger": "#f4566c",
    "scrollbar": "rgba(255,255,255,0.14)"
  },
  "fonts": {
    "body": "'Segoe UI Variable Text', 'Segoe UI', system-ui, sans-serif",
    "heading": "'Segoe UI Variable Display', 'Segoe UI', system-ui, sans-serif",
    "mono": "'Cascadia Mono', Consolas, monospace",
    "size": 14
  },
  "radius": 8,
  "density": "comfortable",
  "nowPlayingBackground": "blur",
  "accentFromCover": true,
  "sidebarWidth": 240,
  "panelWidth": 320,
  "playerHeight": 84
}
